ErrorID,hrResult,ErrorLevel,MarkDelete,ErrorMsg
310,-2147218415,2,0,"The system cannot write to the configuration file, because it was modified since it was last read. Stop and restart the search service.  If this problem persists, reinstall search."
311,-2147218414,2,0,The specified column name is not valid. The application's configuration has been corrupted.  Reinstall the application.
312,-2147218413,2,0,The property ID specified is not valid. The application's configuration has been corrupted.  Reinstall the application.
313,-2147218412,2,0,"An invalid attribute was specified for this tag, or a required attribute is missing. The application's configuration was corrupted.  Reinstall the application."
314,-2147218411,2,0,The specified file name is invalid. This error is obsolete and should no longer be reported.  Call Microsoft Product Support.
315,-2147218410,2,0,A column having the specified property set and PID already exists. The application's configuration has been corrupted.  Reinstall the application.
316,-2147218409,2,0,"The configuration describing a language and sublanguage contains unexpected duplicate information. The application's configuration may be corrupted.  Though basic functionality is unlikely to be impacted, it is recommended that you reinstall the application."
317,-2147218174,2,0,The object you are trying to create already exists. Try again using a different name.
318,-2147218173,2,0,The registry value cannot be read because the configuration is invalid. Recreate the content index configuration by removing the content index.
319,-2147218172,2,0,"The value cannot be set, because the object was already deleted or was not initialized properly. Check that the object reference is still valid, increase the registry size, or recreate the content index configuration."
320,-2147218171,2,0,Performance monitoring cannot be initialized. This affects performance counters only. Try restarting the service or restarting the server.
321,-2147218170,2,0,The specified object cannot be found. Specify the name of an existing object.
322,-2147218166,2,0,"A duplicate index entry exists in the registry. No other indexes are affected, but it is recommended that the duplicate entry be deleted. "
323,-2147218165,2,0,"A duplicate extension entry exists in the registry. The duplicate extension should be deleted, but all other extensions are unaffected."
324,-2147218163,2,0,"The URL was already processed during this update. If you received this message while processing alerts, then the alerts are redundant, or else Modify should be used instead of Add."
325,-2147218162,2,0,The gatherer attempted to create more gatherer plug-in objects than are allowed. Remove another plug-in before adding this one.
326,-2147218161,2,0,"The function is not implemented in this context, and cannot be called.  This error is internal, and cannot normally occur. Reinstall the application."
327,-2147218160,2,0,The plug-in did not provide a filter sink object. You may have installed a custom plug-in that is not supported. 
328,-2147218159,2,0,"The filtering process ended and is now unavailable. The address will be retried, but it is possible that the system is low in resources. Free some system resources, or restart the update when resources are available."
329,-2147218158,2,0,"An unexpected message was received from the filtering process. The crawler will retry this item in the next crawl. If this occurs frequently, try freeing some system resources or closing some applications and restarting the crawl."
330,-2147218157,2,0,The filtering process returned an unsupported property type. Fix the filter to allow successful use of the document.
331,-2147218156,2,0,"The specified name for this object exceeds the maximum length, which is usually 2047 characters. Use a shorter name for the object."
332,-2147218155,2,0,The user agent or e-mail address was not specified. Specify the e-mail address to use in the protocol headers.
333,-2147218154,2,0,The filtering process could not process this item. This might be because you do not have the latest file filter for this type of item. Install the corresponding filter and retry your crawl.
334,-2147218153,2,0,All threads in the filtering process are currently in use. 
335,-2147218152,2,0,"The ProgID for a protocol handler cannot be obtained, and the protocol handler registration is not valid. Reregister the protocol handlers."
336,-2147218151,2,0,The item may be too large or corrupt. You may also verify that you have the latest version of this IFilter.
337,-2147218150,2,0,The protocol handler cannot be found. Check that the handler has been installed.
338,-2147218149,2,0,"The gatherer index was not initialized. The content index must be remounted. If the index is still not initialized, remove it."
339,-2147218142,2,0,The catalog name is not valid. Choose a catalog name that is shorter or does not contain special characters.
340,-2147218141,2,0,The gatherer is shutting down.
341,-2147218139,2,0,The requested value was not set by the filter process. This is a recoverable internal error. The document may still succeed.
342,-2147218138,2,0,All valid document IDs were used. Recreate the content index.
343,-2147218137,2,0,"This content source cannot be crawled, because it is set up to accept alerts."
344,-2147218134,2,0,The property mapping is duplicated in the schema. Remove the duplicate property schema.
345,-2147218132,2,0,The specified account information is incorrect or not valid.  Check that the correct account and password are being used.
346,-2147218130,2,0,"The document cannot be filtered, because the document and filter versions do not appear to match. Install a matching document filter."
347,-2147218129,2,0,"The specified account name cannot be used because it contains invalid characters, such as '\'.  Use a valid account name."
348,-2147218127,2,0,"The proxy server name is missing. Specify a proxy server, and try again."
349,-2147218126,2,0,The server is unavailable and could not be accessed. The server is probably disconnected from the network.
350,-2147218124,2,0,"This path does not correspond to the selected site. Use a path name that matches the site, or use a wildcard (*)."
351,-2147218123,2,0,The document could not be filtered because the required code page is not installed.  Install the code page for this document.
352,-2147218121,2,0,No protocol handler is available. Install a protocol handler that can process this URL type.
353,-2147218120,2,0,"Internet Explorer is set to offline mode. Change Internet Explorer to online mode, and continue."
354,-2147218119,2,0,"The filter process could not be started. The system is most likely low on resources, or the filter process binary was modified. If the resources are available, check the search binaries with an antivirus program."
355,-2147218112,2,0,"The specified URL mapping is invalid. The ""from"" mapping is empty, or the ""from"" mapping is the same as the ""to"" mapping. Specify a valid ""from"" mapping that differs from the ""to"" mapping."
356,-2147218111,2,0,The user agent string was not specified or contains invalid characters. Specify a user agent which is not empty and does not contain double quotation marks.
357,-2147218109,2,0,The e-mail address is missing.  Type an e-mail address.
358,-2147218108,2,0,The specified number of logs to keep is invalid. Set the number of logs to be greater than zero.
359,-2147218107,2,0,The extension string is not specified or is invalid. Specify an extension string that does not contain the following characters: [./?*:\#] or spaces.
360,-2147218106,2,0,The specified maximum grow factor is invalid. Set the maximum grow factor to be greater than or equal to zero.
361,-2147218105,2,0,The specified time out value is invalid. Set the time out value to be greater than or equal to zero.
362,-2147218104,2,0,The specified retry limit value is invalid. Set the retry limit value to be greater than or equal to zero.
363,-2147218103,2,0,The gatherer log file name is not specified. Specify a log file name.
364,-2147218096,2,0,The site name is not specified or is invalid. Specify a site name that does not contain the following characters: [/\\@#|] or spaces.
365,-2147218095,2,0,The content source is not specified or is invalid. Type a host name that does not contain * or spaces.
366,-2147218094,2,0,A catalog with the name specified already exists. Create the catalog using a different name.
367,-2147218093,2,0,"The path is not specified or contains invalid characters, such as ["" ?*]. Specify a path that does not contain these characters."
368,-2147218092,2,0,"The filtering was stopped because of a user action, such as stopping the crawl. "
369,-2147218091,2,0,The specified port for the HTTP proxy is invalid. Specify a port between 0 and 0xffff
370,-2147218089,2,0,The account password was not specified. Specify the password.
371,-2147218088,2,0,The path expression cannot contain the reserved escape character '|'. Use an expression without reserved characters.
372,-2147218087,2,0,The specification for the content source is missing the host name. Specify a valid URL.
373,-2147218080,2,0,"The path specification for the content source cannot contain wildcard characters, such as [?*]. Remove all wildcards from the path specification."
374,-2147218079,2,0,"The specified gatherer application could not be found. Use the name of an existing application, or reinstall the application."
375,-2147218078,2,0,"The application plug-in manager could not be removed because the content index was configured to use the plug-in.  Remove all indexes, and then remove the plug-in manager."
376,-2147218077,2,0,"The application name is invalid, because it contains special characters. Specify a different application name without special characters."
377,-2147218076,2,0,Failed to write to transaction data into SQL.
378,-2147218075,2,0,The data size returned by the filter is greater than the allocated buffer. Download and install an update for the filter.
379,-2147218074,2,0,The object cannot be created on a non-fixed drive. Create the object on another drive.
380,-2147218069,2,0,"The system attempted to load a filter marked as apartment in a multi-threaded filter daemon. The document will be retried in a single-threaded filter. Since multithreaded filtering is more efficient, try to obtain the version of the filter that is multi-threaded."
381,-2147218067,2,0,The identified content was not crawled for this address. Recreate the content index.
382,-2147218065,2,0,The gatherer could not handle the alert stream. All alert sources will be crawled again.
383,-2147218062,2,0,"A duplicate of this document was detected, and the document will be retried. If this problem persists, recreate the content index."
384,-2147218061,2,0,"The administrative data from the Exchange store or registry could not be read. Check that the Exchange store is started, and that it was properly restored."
385,-2147218060,2,0,"Read access to the Exchange store is temporarily unavailable. If this message persists, restart the Exchange store."
386,-2147218058,2,0,"The function is unavailable, because it was called while the word breaker was attempting to fill the text buffer. Download and install an update for the word breaker."
387,-2147218057,2,0,"The property list for the content class of this document could not be loaded, and the schema could not be accessed. Check that the schema is correctly configured."
388,-2147218055,2,0,Crawling could not continue because the local server is not responding. Restart Microsoft SQL Server.
389,-2147218053,2,0,"This item could not be crawled because the repository did not respond within the specified timeout period. Try to crawl the repository at a later time, or increase the timeout value on the Proxy and Timeout page in search administration. You might also want to crawl this repository during off-peak usage times."
390,-2147218052,2,0,Backup and restore is already in progress.  Try again after the current backup has completed.
391,-2147218050,2,0,Restore is already in progress
392,-2147218047,2,0,Annotation transactions always spawn a transaction for the annotated document and then fail themselves.  This is an internal error code and should not be reported to users.  Call Microsoft Product Support.
393,-2147218046,2,0,"Because this document was the target of a shortcut, it cannot itself be a shortcut."
394,-2147218042,2,0,The content source for this alert must refer to a valid file system directory
395,-2147218041,2,0,Alerts for this content source are not supported.
396,-2147218040,2,0,Alerts for this content source could not be established because information about the file share could not be obtained.
397,-2147218039,2,0,Alerts for a content source with a local address are only supported for a fixed media drive type. Use the UNC name for remote file shares.
398,-2147218037,2,0,"The new content index cannot be added because there is not enough disk space.  Free up at least 10 megabytes of free space, and then try again."
399,-2147218036,2,0,The urn:schemas-microsoft-com:publishing:ShortcutTarget property must be type LPWSTR. Change the type for the property to LPWSTR.
400,-2147218035,2,0,The document received an invalid document resource ID.  The document must be crawled again.
401,-2147218034,2,0,Hierarchical content sources such as those in the file system cannot be nested.
402,-2147218027,2,0,The first attempt to crawl this object failed. Another attempt is being made.
403,-2147218026,2,0,"Backup and restore failed during an ESE database phase. For more detailed information, check the event log."
404,-2147218025,2,0,"Backup and restore failed during an ESE database phase. For more detailed information, check the event log."
405,-2147218024,2,0,Backup and restore cannot occur while the content index is being updated. Try again after the current update is complete.
406,-2147218023,2,0,The content index could not be backed up because it could not be read.
407,-2147218021,2,0,"The plug-in is not properly registered on this computer.  Check that the application is properly installed, or contact Microsoft Product Support."
408,-2147218020,2,0,Alerts for this scope were interrupted so that authentication tokens can be updated. 
409,-2147218019,2,0,"File system alerts were not initialized successfully   If the problem persists after restarting the service, try rerunning Setup."
410,-2147218018,2,0,File system alerts for this scope are stopped because the scope is being removed.
411,-2147218017,2,0,"Alerts failed because of network failures or because the internal cache size was exceeded.  If the problem persists, change the content source type to adaptive or crawl."
412,-2147218016,2,0,The operation could not be completed because the specified path is invalid.  Try again using a valid path.
413,-2147218015,2,0,There were not enough keywords in the sample documents to train the Topic Assistant.  Try again when more sample documents are available.
414,-2147218014,2,0,The Topic Assistant requires sample documents from at least two categories.  Try again when sample documents for more categories are available.
415,-2147218013,2,0,There were not enough sample documents to train the Topic Assistant.  Try again when more sample documents are available.
416,-2147218012,2,0,An error occurred using the topic assistant.  Check the event log for related failures.
417,-2147218011,2,0,"The system attempted to load a filter marked as apartment from an embedded component in a multi-threaded filter daemon. The document will be retried in a single-threaded filter. Since multithreaded filtering is more efficient, try to obtain the version of the filter that is multi-threaded."
418,-2147218008,2,0,Backup and restore cannot occur while a content index is being updated.
419,-2147218006,2,0,The security descriptor for this item only contained built-in access control entries. The built-in ACEs have to be removed because they won't be valid for this item during queries.
420,-2147217962,2,0,The content processing component failed to process the security descriptor of the item.
421,-2147218005,2,0,The context for this object is no longer valid.  Refresh the context for this object.
422,-2147218003,2,0,Backup and restore cannot occur while the content index is being created or deleted.  Try again later.
423,-2147218002,2,0,"The checkpoint cannot be enabled, because the content index is not idle.  Wait until the index is idle, and then try again."
424,-2147218001,2,0,The maximum number of search scopes was reached. Use one of the existing scopes.
425,1074007472,2,0,Maximum number of properties per document has been reached. The indexing of this document has been truncated.
426,-2147217999,2,0,Password specified during restore does not match the backup password.
427,-2147217998,2,0,The start address is invalid because it is a local path.  Please enter a valid start address.
428,-2147217996,2,0,The filtering process has been terminated
429,-2147217995,2,0,The current system locale is different from the system locale in the backup image
430,-2147217994,2,0,"The backup image cannot be verified because the image may be corrupted. To preserve your data, it is recommended that you run Data Backup and Restore again."
431,-2147217992,2,0,The links for this document cannot be processed due to a OLEDB error. The document will be retried in the next crawl
432,-2147217991,2,0,An attempt was made to update application level configuration with an obsolete view of the current state.  Refresh your application-level objects and redo the update.
433,-2147217990,2,0,The application is unable to accept further updates because the last attempt to persist the state failed.  See the event log for more details.
434,-2147217985,2,0,The crawl component is disabled.
435,-2147217980,2,0,The repository returned an out of memory error.
436,-2147217979,2,0,"This item was marked as Offline and was not crawled. If you would like this crawled, remove offline attribute from the file."
437,-2147217978,2,0,"This item will be retried as a part of the next crawl. If this belongs to a SharePoint repository, all items below this will also be retried in the next crawl."
438,-2147217976,2,0,This item cannot be indexed by the search system because it has a security descriptor larger than 64K.
439,-2147217975,2,0,The filter daemon did not respond within the timeout limit.
440,-2147217973,2,0,The content processing pipeline failed to process the item.
441,-2147217972,2,0,An unexpected error occurred when trying to submit the item to content processing. This item will be retried in the next incremental crawl.
442,-2147217971,2,0,The item was aborted because the pipeline did not respond within the appropriate time. This item will be retried in the next crawl.
443,-2147217970,2,0,The content plugin failed to process the item.
444,-2147217947,2,0,Directory Links across partitions are not allowed.
445,-2147217946,2,0,SharePoint list is corrupted. The list item doesn't have a display URL.
446,-2147217945,2,0,Continuous crawl cannot be enabled because the disable operation is in progress. Retry to enable it.
447,-2147217941,2,0,Unable to process item: wordbreaker problem.
448,-2147217940,2,0,Unable to process item: dictionary loading problem.
449,-2147217939,2,0,Unable to process item: language detection problem.
450,-2147217151,2,0,The tag is invalid. This error is obsolete and should no longer be reported.  Call Microsoft Product Support.
451,-2147217150,2,0,"The propagation configuration file cannot be read.  Check that the same versions of search are used on both the content index and search servers.  If the problem persists, recrawl and repropagate the content index. "
452,-2147217149,2,0,"The number of search servers exceeded the limit.  Ensure that the number of propagated content indexes is less than the documented maximum.  If so, start and restart the search service, and then try again."
453,-2147217148,2,0,The specified search server already exists. This error is obsolete and should no longer be reported.  Call Microsoft Product Support.
454,-2147217147,2,0,An update is already in progress. This error is obsolete and should no longer be reported.  Call Microsoft Product Support.
455,-2147217146,2,0,The index list file cannot be read. This error is obsolete and should no longer be reported.  Call Microsoft Product Support.
456,-2147217145,2,0,"A registry entry required for content index creation cannot be read or created. Delete and recreate the content index.  If the problem persists, you may need to reinstall search."
457,-2147217144,2,0,"One or more files required for content index creation were not found. Stop and restart the search service.  If the problem persists, delete and recreate the content index."
458,-2147217143,2,0,"The search server was not found. Stop and restart the search service.  If propagation is being used, stop and restart the search service on the remote computers."
459,-2147217142,2,0,"A word breaker was not found for the given language. Check your current language settings and ensure that search supports the current language.  If the problem persists, reinstall search."
460,-2147217141,2,0,A noise word list was not found for the given language. This error is obsolete and should no longer be reported.  Call Microsoft Product Support.
461,-2147217140,2,0,A stemmer was not found for the given language. This error is obsolete and should no longer be reported.  Call Microsoft Product Support.
462,-2147217139,2,0,Index propagation was stopped.  This error is obsolete and should no longer be reported.  Call Microsoft Product Support.
463,-2147217138,2,0,The disk is full. This error is obsolete and should no longer be reported.  Call Microsoft Product Support.
464,-2147217137,2,0,The index data is invalid. This error is obsolete and should no longer be reported.  Call Microsoft Product Support.
465,-2147217136,2,0,The index data is corrupt. This error is obsolete and should no longer be reported.  Call Microsoft Product Support.
466,-2147217135,2,0,There is no backup content index. This error is obsolete and should no longer be reported.  Call Microsoft Product Support.
467,-2147217134,2,0,The property store cannot be initialized. This error is obsolete and should no longer be reported.  Call Microsoft Product Support.
468,-2147217133,2,0,The propagation state information cannot be read. This error is obsolete and should no longer be reported.  Call Microsoft Product Support.
469,-2147217129,2,0,"The content index is not loaded. Stop and restart the search service.  If the problem persists, review other errors in the event log. If necessary, delete and recreate the content index."
470,-2147217128,2,0,"There is a mismatch in the major version number. Check that the same versions of search are used on both the content index and search servers.  If necessary, crawl the index again and repropagate the index. "
471,-2147217127,2,0,The index is a mismatch in the minor version number. This error is obsolete and should no longer be reported.  Call Microsoft Product Support.
472,-2147217126,2,0,"A connection with the Search service on a remote machine could not be established. Check the connectivity with the remote machine.  If necessary, stop and restart the Search service on the remote machine."
473,-2147217125,2,0,Crawling of documents was stopped. This is an internal error code and should not be reported to users.  Call Microsoft Product Support.
474,-2147217124,2,0,"The index was dismounted because it is being removed or the search service stopped.  If the problem persists, restart the search service."
475,-2147217121,2,0,No index level information exists for this index. Use application level tables for this index.
476,-2147217120,2,0,Information for this content class was not found. Use the default content class.  This error is obsolete and should no longer be reported.  Call Microsoft Product Support.
477,-2147217119,2,0,The content index cannot be updated while backup and restore is in progress.
478,-2147217025,2,0,"The content index server cannot update or access information because of a database error.  Stop and restart the search service.  If the problem persists, reset and recrawl the content index.  In some cases it may be necessary to delete and recreate the content index."
479,-2147217023,2,0,"The content index server cannot find a description of the content index in its database. Search will automatically attempt to recreate the content index description.  If this problem persists, stop and restart the search service and, if necessary, delete and recreate the content index."
480,-2147217022,2,0,The content index server cannot find needed information in its database. Reset and recrawl the content index.
481,-2147217021,2,0,"The content index server cannot update or access its database, because the version store has insufficient resources.  Increase the system resource usage setting for the search service.  If the problem persists, stop and restart the search service."
482,-2147217020,2,0,"The content index server cannot update or access its database because sessions are unavailable. Increase the system resource usage setting for the search service.  If the problem persists, stop and restart the search service."
483,-2147217019,2,0,"The content index server cannot update or access its database because insufficient system resources are available. Increase the system resource usage setting for the search service.  If the problem persists, stop and restart the search service."
484,-2147217018,2,0,The content index server cannot update an unrecognized or recently defined property attribute. Reset and recrawl the content index.
